{
  "id": "ask_about_aws",
  "agent": "persona",
  "description": "Client asks about AWS experience (in profile).",
  "tags": [
    "happy"
  ],
  "source": {
    "structured_profile": {
      "name": "Alex Rivera",
      "title": "Senior Technology Consultant",
      "summary": "Senior consultant; AWS cloud migration and microservices for financial services.",
      "skills": [
        "AWS",
        "Microservices",
        "Python",
        "Kafka",
        "Terraform"
      ],
      "experience": [
        {
          "company": "Tikal Tech",
          "role": "Senior Consultant",
          "duration": "2020-Present",
          "description": "Led AWS cloud migration for a Tier-1 bank.",
          "technologies": [
            "AWS",
            "Microservices"
          ],
          "achievements": [
            "Cut infrastructure cost 35%"
          ]
        }
      ],
      "projects": [
        {
          "name": "Bank CloudShift",
          "description": "Full cloud migration to AWS",
          "technologies": [
            "AWS"
          ]
        }
      ],
      "education": [
        {
          "degree": "B.Sc. CS",
          "institution": "Tel Aviv University",
          "year": "2015"
        }
      ],
      "certifications": [
        "AWS Solutions Architect - Professional"
      ],
      "tone_markers": "Direct and pragmatic; uses concrete metrics."
    },
    "relevance_map": {
      "top_matches": [
        {
          "type": "experience",
          "item": "AWS migration for Tier-1 bank",
          "relevance_score": 9,
          "reason": "Directly matches AWS + migration need",
          "suggested_framing": "Lead with the bank migration."
        }
      ],
      "secondary_matches": [],
      "client_tone_match": "Be direct, use metrics.",
      "headline_positioning": "Proven AWS migration lead for payments."
    }
  },
  "input": {
    "structured_profile": {
      "name": "Alex Rivera",
      "title": "Senior Technology Consultant",
      "summary": "Senior consultant; AWS cloud migration and microservices for financial services.",
      "skills": [
        "AWS",
        "Microservices",
        "Python",
        "Kafka",
        "Terraform"
      ],
      "experience": [
        {
          "company": "Tikal Tech",
          "role": "Senior Consultant",
          "duration": "2020-Present",
          "description": "Led AWS cloud migration for a Tier-1 bank.",
          "technologies": [
            "AWS",
            "Microservices"
          ],
          "achievements": [
            "Cut infrastructure cost 35%"
          ]
        }
      ],
      "projects": [
        {
          "name": "Bank CloudShift",
          "description": "Full cloud migration to AWS",
          "technologies": [
            "AWS"
          ]
        }
      ],
      "education": [
        {
          "degree": "B.Sc. CS",
          "institution": "Tel Aviv University",
          "year": "2015"
        }
      ],
      "certifications": [
        "AWS Solutions Architect - Professional"
      ],
      "tone_markers": "Direct and pragmatic; uses concrete metrics."
    },
    "relevance_map": {
      "top_matches": [
        {
          "type": "experience",
          "item": "AWS migration for Tier-1 bank",
          "relevance_score": 9,
          "reason": "Directly matches AWS + migration need",
          "suggested_framing": "Lead with the bank migration."
        }
      ],
      "secondary_matches": [],
      "client_tone_match": "Be direct, use metrics.",
      "headline_positioning": "Proven AWS migration lead for payments."
    },
    "user_message": "Tell me about your AWS experience.",
    "conversation_history": []
  }
}