{
  "id": "happy_conversation",
  "agent": "debrief",
  "description": "Multi-turn conversation summarized.",
  "tags": [
    "happy"
  ],
  "source": {
    "transcript": [
      {
        "role": "user",
        "content": "Do you have AWS experience?",
        "timestamp": "2026-01-01T10:00:00"
      },
      {
        "role": "assistant",
        "content": "Yes, I led an AWS migration for a Tier-1 bank.",
        "timestamp": "2026-01-01T10:00:05"
      },
      {
        "role": "user",
        "content": "How did you handle PCI-DSS?",
        "timestamp": "2026-01-01T10:01:00"
      },
      {
        "role": "assistant",
        "content": "I worked within the bank's compliance regime during the migration.",
        "timestamp": "2026-01-01T10:01:08"
      }
    ]
  },
  "input": {
    "transcript": [
      {
        "role": "user",
        "content": "Do you have AWS experience?",
        "timestamp": "2026-01-01T10:00:00"
      },
      {
        "role": "assistant",
        "content": "Yes, I led an AWS migration for a Tier-1 bank.",
        "timestamp": "2026-01-01T10:00:05"
      },
      {
        "role": "user",
        "content": "How did you handle PCI-DSS?",
        "timestamp": "2026-01-01T10:01:00"
      },
      {
        "role": "assistant",
        "content": "I worked within the bank's compliance regime during the migration.",
        "timestamp": "2026-01-01T10:01:08"
      }
    ]
  }
}